source,date,title,url,body_text,section
La Prensa Austral,2025-10-04,expoclasicos reunira a centenar de autos en apoyo a la rehabilitacion,https://laprensaaustral.cl/2025/10/04/expoclasicos-reunira-a-centenar-de-autos-en-apoyo-a-la-rehabilitacion/,"la pasion por los autos clasicos se pondra al servicio de una causa solidaria hoy sabado, cuando a partir de las 14 horas se realice una nueva version de la expoclasicos en los estacionamientos de zona franca, frente al cine. el evento forma parte de las actividades que apoyan las jornadas por la rehabilitacion en magallanes y se ha transformado en una tradicion para la comunidad. roberto briones altamirano, integrante del club de amigos de autos antiguos, dijo que la iniciativa nace de un convenio con el club de leones cruz del sur hace varios anos. “es un evento familiar, que al fanatico de los autos y a toda la familia le gusta. hicimos este compromiso de todos los anos realizar un evento en apoyo a las jornada por la rehabilitacion”. el expositor destaco que cada muestra congrega a una gran cantidad de asistentes. “la gente, muchas veces, cuando uno arma un vehiculo o repara algo asi, queda con las ansias de contarselo o de mostrarselo a alguien. esta es una instancia que se hace una vez al ano, entonces la gente se prepara un ano, prepara su auto, porque lleva tiempo, plata, pero mas que nada tiempo. la gente es feliz compartiendo su proyecto con toda la comunidad”. en esta version se espera la presencia de alrededor de 100 vehiculos, incluyendo motos y automoviles que datan desde la decada del 30 en adelante. el evento se inicia a las 14 horas y se extendera hasta las 19 horas. la entrada es un aporte voluntario, con alcancias que estaran dispuestas en el perimetro de ingreso. cualquier aporte sera bienvenido. el dirigente detallo, ademas, que la actividad cuenta con la organizacion de cuatro agrupaciones: el club de amigos de autos antiguos de magallanes, american muscle car punta arenas, fuscaria y los mini cooper. “son cuatro agrupaciones que siempre estan presentes, nos juntamos y organizamos eventos clasicos. hay dos al ano: uno para el dia del patrimonio y el otro para apoyar la jornada de la rehabilitacion. llevamos cuatro anos con este compromiso junto al club de leones”. francisco barria barrientos, segundo vicepresidente del club de leones cruz del sur, valoro la contribucion de los clubes de automovilistas a esta cruzada solidaria. “nosotros contamos siempre con agrupaciones que nos ayudan y como en este caso el club de amigos de autos antiguos de magallanes nos coopera todos los anos. es una agrupacion que muestra sus autos con todos los arreglos que tiene y llega mucho a la comunidad, especialmente a los fanaticos y a los ninos”. el dirigente anadio que las actividades para recaudar fondos se intensifican a medida que se acerca la fecha central de las jornadas. “ya nos estamos acercando al termino de esta campana que se inicia normalmente en marzo y cada dia tenemos mas actividades. hoy dia estamos incluso celebrando los 39 anos del club de los centros de rehabilitacion, vamos a tener una cena con los funcionarios, estamos preparando la rifa y tenemos actividades por todos lados, ya no descansa nadie”. sobre la rifa, barria recordo que los numeros siguen a la venta a un valor de 3 mil pesos. “la rifa se va a sortear el dia de las jornadas y ha tenido muy buena acogida. estamos todos los fines de semana en zona franca, sabado y domingo, ademas de otros lugares”.",Crónica
La Prensa Austral,2025-10-03,gobierno regional sufrira recorte presupuestario cercano al 2%,https://laprensaaustral.cl/2025/10/03/gobierno-regional-sufrira-recorte-presupuestario-cercano-al-2/,"– la reduccion es inferior al 4,4% que se habia especulado. el gobierno regional contara con $90.999 millones, sin incluir ingresos por zona franca ni casinos. tras casi un mes de tensiones entre los gobernadores regionales y el ministerio de hacienda por los eventuales recortes a las arcas regionales, se cumplio lo anunciado por el ministro nicolas grau: el presupuesto del gobierno regional de magallanes sufrira un recorte del 1,9%. esta baja es menor a la que especulaban los medios de comunicacion, la cual ascendia a un 4,4%. la administracion flies recibira $90.999 millones el proximo ano, es decir, $1.807 millones menos que los presupuestados para este ano por la direccion de presupuestos ($92.806 millones). esta rebaja se aplico al monto inicial propuesto por la dipres, el cual aun puede sufrir modificaciones durante la discusion parlamentaria o a lo largo del ano. los cerca de $91.000 millones propuestos para 2026 no contemplan los ingresos que recibira la administracion flies por zona franca, ley de casinos y plan de desarrollo de zonas extremas. a diferencia del resto de las regiones, en magallanes al presupuesto local se suman los ingresos provenientes del fondo de desarrollo de magallanes (fondema), los cuales inyectan mas de $11.000 millones (ver informacion pagina 4). durante los dias previos a la presentacion del presupuesto 2026, el seremi de hacienda, alvaro vargas, senalo que los recortes se iban a realizar de acuerdo al desempeno presupuestario de este ano por parte de los gobiernos regionales. a la hora de presentar el erario del proximo ano, el presidente boric senalo que uno de los objetivos es frenar el crecimiento de la deuda publica y poner en acento en seguridad social, publica y economica. ¿donde se recorto? hubo una baja en tres items presupuestarios. se recortaron $519 millones del fondo de apoyo al transporte publico, popularmente conocido como “fondos espejo”, el cual reparte entre las regiones la misma cantidad de recursos que el estado aporta para la region metropolitana, con el fin de mejorar la infraestructura, el transporte publico y conectar zonas aisladas. el aporte fiscal al gobierno regional de magallanes se contrajo en un 2,8%, pasando de $49.817 millones en 2025 a $48.400 millones para el proximo ano. otro ingreso que cayo fue el proveniente de la “modernizacion tributaria”, el cual fue rebajado en $25 millones. funcionamiento magallanes fue una de las siete regiones en donde se aumentaron los recursos destinados al funcionamiento de los gobiernos regionales. estos creceran un 1,7%, pasando de $8.200 millones en 2025 a $8.341 millones para el proximo ano. con estos dineros se costean servicios basicos y generales, materiales de oficina, arriendos y el financiamiento del consejo regional. a este ultimo se le pagan pasajes, reembolsos por sesiones, viaticos, capacitaciones y seguros contra riesgos de accidentes del trabajo y enfermedades profesionales.",Crónica
La Prensa Austral,2025-09-30,magallanes pone el corazon: la campana de las jornadas por la rehabilitacion entra a su recta final,https://laprensaaustral.cl/2025/09/30/magallanes-pone-el-corazon-la-campana-de-las-jornadas-por-la-rehabilitacion-entra-a-su-recta-final/,"l a region se prepara para vivir un nuevo capitulo de uno de sus hitos mas significativos: las jornadas por la rehabilitacion. a pocas semanas del cierre de su 38ª version, fijado para el 25 de octubre en punta arenas, el llamado es claro: la meta de este ano es reunir 1.300 millones de pesos, recursos fundamentales para dar continuidad a los centros de rehabilitacion que entregan terapias y acompanamiento a ninas, ninos, jovenes y adultos en la region. el presidente del club de leones cruz del sur, alejandro vasquez, destaco que el ultimo mes de campana es decisivo. “estamos trabajando en multiples frentes para que la gente nos apoye y nos crea. cada alcancia, cada actividad y cada corazon vendido suma a este esfuerzo colectivo por la rehabilitacion”, senalo, recordando que ya hay cerca de 5.000 alcancias recorriendo magallanes gracias al apoyo de colegios, instituciones y comercios que se han sumado al desafio. mas alla de las cifras, el sentido profundo de las jornadas esta en las historias de vida que sostienen. lo recaudado se traduce en terapias kinesicas, psicologicas, fonoaudiologicas y ocupacionales, en programas de inclusion y en el funcionamiento de los centros de punta arenas, puerto natales, porvenir y proximamente puerto williams. para muchas familias, este esfuerzo comunitario marca la diferencia entre tener o no acceso a una rehabilitacion digna y cercana. la campana se nutre de un calendario diverso de actividades que convocan a la comunidad en distintos espacios. la expoclasicos 2025 en zona franca, el 4 de octubre; el asado campero en puerto natales; el asado magallanico solidario en santiago junto con un campeonato de truco; y la “corrida x la rehabilitacion”, que se realizara el 11 de octubre en el muelle arturo prat de punta arenas, son solo algunos de los hitos que buscan unir a las familias en torno a la solidaridad. proyecto crea corazones uno de los simbolos mas entranables de esta edicion es el proyecto crea corazones, que vive su tercera version. liderado por la ceramista paola romero scherf, se ha transformado en mucho mas que una campana: es un taller vivo donde pacientes, funcionarios y voluntarios del centro de rehabilitacion encuentran un espacio de encuentro y expresion. alli, entre manos de barro y fuego, surgen corazones de ceramica unicos que llevan impreso el esfuerzo, la memoria y la esperanza de quienes participan. el corazon 2025, abrazado por tres manitos de colores azul, morado y amarillo, recuerda que la rehabilitacion nunca es un camino solitario, sino un proceso compartido. cada pieza encierra el mensaje de que la confianza, la empatia y el optimismo son fuerzas capaces de transformar vidas. la preventa comenzo el sabado 27 de septiembre en el salon austral de zona franca y, segun relatan desde la organizacion, la respuesta fue abrumadora. “nos fue espectacular, tuvimos super buena acogida del publico. nos sirvio para informar, la gente que no conocia el proyecto pudo verlo e interiorizarse y mucha gente emocionada, todos querian seguirnos, asi que fue muy bueno. muchas personas hicieron reserva”, senalo la cereamista que lidera el proyecto. el cierre de esta etapa sera el proximo sabado, cuando comience la entrega oficial de los corazones, con una meta clara: 100 piezas hechas a mano que representan 100 oportunidades de apoyar la rehabilitacion. en cada alcancia, en cada actividad comunitaria, en cada corazon de ceramica, late la conviccion de que magallanes ha hecho suya esta cruzada solidaria. las jornadas no son solo un evento anual: son un tejido de voluntades que, desde hace casi cuatro decadas, sostienen a cientos de familias en sus procesos de rehabilitacion. en tiempos en que los desafios parecen enormes, la region vuelve a demostrar que cuando une sus manos y corazones, la esperanza se multiplica.",Crónica
La Prensa Austral,2025-09-28,punto de carga para vehiculos electricos en zona franca,https://laprensaaustral.cl/2025/09/28/punto-de-carga-para-vehiculos-electricos-en-zona-franca/,"en el sector de estacionamientos de la etapa iii del modulo central de punta arenas, se inauguro un punto de carga electrica vehicular. se trata de una iniciativa desarrollada en conjunto entre la empresa sociedad de rentas inmobiliarias ltda. y la empresa electrica de magallanes (edelmag). de acuerdo a lo informado, este proyecto constituye un paso concreto en el compromiso de ambas instituciones con el medio ambiente, promoviendo la innovacion energetica y el uso de tecnologias limpias al servicio de la comunidad.",Crónica
La Prensa Austral,2025-09-27,magallanes y el salto pendiente hacia la industrializacion energetica,https://laprensaaustral.cl/2025/09/27/magallanes-y-el-salto-pendiente-hacia-la-industrializacion-energetica/,"¿ es magallanes un polo energetico para chile? el debate no puede quedarse solo en la critica al sistema burocratico. la region austral reune condiciones unicas para convertirse en el mas eficiente hub mundial de hidrogeno y amoniaco verde, con factores de planta eolica superiores al 50%, una cifra que duplica la media global. tal potencial, junto con su posicion geopolitica, frente a la antartica, permite proyectar una plataforma logistica estrategica y a escala planetaria. mas aun, un polo industrial con base exportadora bioceanica, ya que se puede navegar en ruta directa hacia la proyeccion atlantica o del oceano pacifico. pero el potencial no basta: se requieren tres ejes de desarrollo industrial claros. primero, la formacion tecnica local. solo en la etapa inicial de los proyectos de hidrogeno verde se proyecta una demanda de mas de 8.000 tecnicos y profesionales, cifra que podria llegar a 12.000 empleos directos e indirectos en una decada. lo anterior, obliga a implementar centros de capacitacion en punta arenas y programas de recertificacion de competencias para promover, por ejemplo, operacion de electrolizadores, mantenimiento de aerogeneradores y logistica energetica, evitando que la poblacion local quede relegada a creativos puentes aereos. una solucion real a la desocupacion historica de magallanes (6.600 desempleados a junio de 2025) con una fuente de largo plazo aproximadamente equivalente al 10 % de la fuerza laboral de la region. en segundo lugar, la infraestructura habilitante es critica. la transicion energetica exigira puertos de gran capacidad, carreteras de servicio y redes electricas de alto estandar. hoy, la exportacion de metanol a partir de gas natural muestra los limites de un modelo logistico insuficiente. invertir en un puerto ampliado en punta arenas, capaz de operar multiples atraques y aumentar tonelaje, significaria reducir sustancialmente los costos logisticos y asegurar competitividad frente a polos emergentes en argentina y uruguay. la automatizacion de los terminales portuarios es una realidad. magallanes necesita puertos modernos, robotizados, automatizados e interoperables con la red logistica necesaria. el tercer eje es la descentralizacion efectiva. sin autonomia regional, las inversiones proyectadas, que podrian superar los 70 mil millones de dolares hacia 2050 en hidrogeno y amoniaco verde, corren el riesgo de perderse. sin embargo, una zona franca integral, que no solo abarque bienes fisicos, sino tambien servicios de ingenieria, consultoria y tecnologia cambia el panorama. ademas, un esquema de incentivos fiscales podria elevar la inversion extranjera directa un 25% en apenas cinco anos, siguiendo experiencias como las de singapur o manaos. es imprescindible robustecer la zona franca de magallanes, ampliandola para incluir exenciones tributarias para equipos de alta tecnologia como electrolizadores, aerogeneradores y sistemas de transmision, junto con beneficios para empresas de ingenieria y consultoria que se establezcan localmente. estas medidas no solo facilitarian la atraccion de capital, sino que permitirian consolidar cadenas de valor regionales, asegurando que parte de la inversion se quede en el territorio y no emigre a paises vecinos. finalmente, un golpe de realidad ayuda a dimensionar la magnitud del desafio. en el puerto de bahia catalina, en punta arenas, el reciente desembarque de solo dos aerogeneradores destinados al proyecto de total en tierra del fuego, argentina, tomo tres dias completos. si ese mismo ritmo se aplicara a los futuros proyectos de hidrogeno verde en magallanes, se necesitarian mas de 12 anos unicamente para descargar la totalidad de los aerogeneradores. la cifra es elocuente: sin modernizacion inmediata de la infraestructura portuaria y sin incentivos que aceleren la inversion, la region corre el serio riesgo de quedar fuera de competencia antes de iniciar la carrera energetica global. magallanes tiene el viento, la historia y la resiliencia para ser la punta de lanza de la transicion energetica de chile. pero requiere mas que discursos: demanda un marco regulatorio agil, puertos modernos, formacion laboral avanzada y autonomia politica real. porque no hablamos solo de una oportunidad regional, sino de una decision estrategica para que chile no sea un mero espectador de la nueva economia energetica global. si fallamos, esta region sublime de pioneros, iluminada por tardes boreales, vera el mundo avanzar sin ella, repitiendo la amarga leccion que nos dejo el canal de panama, cuando el paso austral del estrecho de magallanes fue desplazado como la principal ruta comercial bioceanica del continente.","Columnas, Pulso económico"
La Prensa Austral,2025-09-27,de las mascarillas de tela a la confeccion artesanal: la historia de manualidades mary,https://laprensaaustral.cl/2025/09/27/de-las-mascarillas-de-tela-a-la-confeccion-artesanal-la-historia-de-manualidades-mary/,"maria angelica fontana transformo su pasion por el bordado y la costura en un negocio formal que hoy ofrece productos unicos hechos a mano, con envios a todo chile. l o que comenzo como una manera de pasar el encierro durante la pandemia termino por convertirse en un proyecto de vida. maria angelica fontana carcamo, creadora de manualidades mary, recuerda que sus primeras confecciones fueron mascarillas de tela, hechas para matar el aburrimiento. sin embargo, rapidamente se convirtieron en un exito. “llamaban mucho la atencion porque las telas las traia del norte y la gente empezo a combinarlas con su ropa. de ahi, a sugerencia de una clienta, me atrevi a hacer cintillos, llaveros y otras cosas”, relata. ese impulso inicial la llevo a profesionalizar su pasion. con el apoyo de una amiga, postulo al programa emprende de sercotec y resulto ganadora, lo que le permitio formalizar su negocio y ampliar la produccion. anos despues, tambien fue beneficiada con el ruta digital, que le entrego herramientas para dar el salto al mundo digital, incluyendo la creacion de pagina web, y el apoyo de la fundacion luksic. hoy, manualidades mary ofrece una amplia gama de productos: desde panos de cocina de algodon americano —considerados su “producto estrella” por la alta demanda— hasta cuellos inspirados en caricaturas, porta panuelos reutilizables, billeteras, monederos y articulos hechos con telas recicladas como bikinis y camisas. “la verdad que si no estoy sentada en mi maquina, no soy feliz. me encanta lo que hago, lo disfruto. mi lema es hecho a mano, hecho con amor, porque realmente me fascina lo que hago”, enfatiza. la emprendedora reconoce que el amor por las manualidades viene de su infancia. aprendio a tejer en la escuela, y a los 13 anos recibio su primera maquina de coser, regalo de su madre. desde entonces, coser y bordar se convirtieron en un pasatiempo constante, aunque durante mucho tiempo solo fue un hobby. “de repente mis conocidos me pedian cosas y yo se las hacia, pero nunca pense que podia ser un negocio. no creia en los proyectos, pensaba que no servian, hasta que me atrevi y me fue bien”, confiesa. actualmente, sus productos se comercializan principalmente en ferias locales —como las que se realizan en zona franca—, pero tambien a traves de redes sociales. en instagram y facebook (manualidades mary), muestra su catalogo y recibe pedidos personalizados.",Pulso económico
La Prensa Austral,2025-09-21,"siempre te recordaremos, yaco monti",https://laprensaaustral.cl/2025/09/21/siempre-te-recordaremos-yaco-monti/,"el viernes 18 de septiembre murio en buenos aires el cantante, compositor y actor yaco monti. estuvo ligado estrechamente a nuestro pais, donde tuvo un exito descollante, diriamos que aqui fue mas conocido y famoso que en argentina. su ultima actuacion en chile fue el 15 de junio del presente ano en el teatro caupolican de santiago; con ochenta anos cumplidos se puede apreciar que sus condiciones vocales conservaban en gran medida el nivel de su epoca de oro. el cantante tuvo muchisimos exitos, pero, sin duda, su mayor impacto fue “siempre te recordare” (“que tienen tus ojos, que yo no te olvido…”) con el cual gano en 1966 el festival de punta del este. solo meses despues, se presento en el teatro caupolican de santiago, el fortin prat de valparaiso y el estadio braden de rancagua en una funcion a beneficio de los bomberos de esta ciudad. ademas, poso para la recordada revista de fotonovelas “cine amor” en el episodio “aprender a vivir”. tambien fue invitado al programa “el discjockey de la noche” en radio chilena de santiago animado por juan carlos gil, quien hace algunos anos nos conto que, estando ya en el estudio con la transmision al aire y antes de que comenzara la entrevista, le solicita autorizacion para pronunciar dos palabras, peticion a la que juan carlos gil accede. entonces, toma el microfono y exclama: ¡mama llegue…! el cantante al notar la sorpresa del locutor le explico que las ondas de radio chilena llegaban hasta su natal villa mercedes y que el acostumbraba a escuchar “el discjockey de la noche” en compania de su mama, a quien le decia: “mamita algun dia voy llegar a chile y me vas a escuchar desde aca”, senalando el receptor de radio. julio cesar eugenio monti nacio el 17 de diciembre de 1942 en villa mercedes, provincia de san luis, argentina. crecio en el seno de una modesta familia compuesta por ocho hermanos. era tecnico electricista de aviacion, pero decidio probar suerte en la musica, entonces paralelamente a la composicion de canciones desempeno diversos oficios. su estrellato fue mas bien efimero: desde 1966 hasta 1970, su ultimo gran impacto fue “esta dormida”. nunca dejo de actuar en distintos paises, principalmente estados unidos, colombia, ecuador y chile. trabajaba con sus tres hijos; facundo y jonathan (compositores y cantantes) y gonzalo quien es su manager. paralelamente a sus presentaciones, se dedico a la avicultura y luego, a la produccion de vinos en mendoza. un hito importante de su carrera fue la grabacion de “yaco en paris” en 1969 acompanado de la orquesta del gran musico frances franck pourcel. de esa produccion destacan “la vida sigue igual” de julio iglesias y “mantelito blanco” de nicanor molinare, autor que residiera un tiempo en punta arenas. a nuestra region llego en algunas ocasiones, la primera vez se presento en punta arenas en el gimnasio de la confederacion deportiva con un lleno total. tambien actuo en puerto natales, en el gimnasio del deportivo natales en calle eberhard con un exito arrollador. el sabado 9 de enero de 2016 actuo por ultima vez en nuestra ciudad. en esa ocasion fuimos a saludarlo y tratar de conseguir una entrevista. tuvimos el honor de asistir a la prueba de sonido, en la cual lo apoyaban sus hijos facundo y jonathan. luego de ello fuimos a la zona franca, pues los muchachos necesitaban comprar algunos implementos de sonido. yaco monti era sencillo, muy agradable, un buen tipo. algunas personas se acercaban a saludarlo y se tomaban fotos con el, a lo cual accedia con gran gentileza, posando con su inconfundible estampa, en la cual destacaban sus lentes oscuros ray ban; su sello personalisimo. entrevista no hubo, fueron conversaciones de la vida, de temas diversos, pues era un tipo muy culto. recuerdo que aproveche de comentarle que el escritor chileno antonio skarmeta, senalo en un capitulo de su programa “el show de los libros” que a pablo neruda le gustaba su cancion “amor desesperado” y que, en una feria del libro de buenos aires, el se le habria acercado y le pregunto: “senor ¿usted es antonio skarmeta? mucho gusto, yo soy yaco monti” y habrian conversado sobre neruda y la cancion. yaco monti confirmo el episodio, se acordaba perfectamente y nos senalo: “¡imaginate el honor que a neruda le haya gustado una cancion mia!” al tiempo de declararse un admirador del vate y gran conocedor de su obra. la partida de yaco monti cierra un capitulo de la historia de la cancion romantica en espanol. el artista surge en un momento complicado para este genero, por la irrupcion de otros ritmos. fue unico, creo un estilo de composicion, interpretacion y actuacion personalisimo. ademas, fue un referente indiscutido de otros musicos romanticos, muchos de los cuales reconocen en el su fuente de inspiracion. hasta siempre yaco monti: “siempre te recordaremos”.",Columnas
