source,date,title,url,body_text,section
La Prensa Austral,2025-07-15,juan magal presenta su ultimo libro “ecografia del espacio que habitamos”,https://laprensaaustral.cl/2025/07/15/juan-magal-presenta-su-ultimo-libro-ecografia-del-espacio-que-habitamos/,"el escritor magallanico juan magal presento su mas reciente obra literaria, “ecografia del espacio que habitamos”, que recopila textos de distintas etapas de su trayectoria literaria, con un marcado enfoque en la region de magallanes y su historia. el autor senala que se trata de un libro construido a partir de textos escritos a lo largo de varios anos, a los que se suman trabajos recientes. segun indica, es mas bien “una especie de antologia” que recorre diferentes momentos de su proceso creativo. aunque no establece limites formales entre generos, el volumen recoge principalmente textos que se situan en los margenes de la poesia y el cuento, manteniendo siempre un anclaje regional en su mirada. uno de los elementos centrales de esta obra es el poema que da titulo al libro, el cual propone una metafora visual y geografica de la region. magal observa que, al mirar el mapa regional, la peninsula de brunswick parece la silueta de un bebe en el vientre materno, rodeado por el estrecho de magallanes como si fuera el liquido amniotico. a partir de esa imagen, el texto desarrolla un recorrido lirico por la geografia austral, describiendo canales, fiordos e islas, en un transito simbolico por el territorio que habitan los magallanicos. el libro tambien recoge elementos historicos y culturales propios de magallanes, que el autor considera valiosos no solo para quienes nacieron en la region, sino tambien para quienes la visitan. a esto se suman referencias a la literatura clasica, en particular a la iliada de homero, obra que magal ha releido con devocion y que inspira algunos de sus poemas. la publicacion incluye, ademas, textos de caracter mas intimo y otros marcados por una perspectiva social, como aquel que rememora el impacto de la editorial quimantu en los anos de su infancia. el volumen fue acogido por la editorial ateli y cuenta con un prologo del autor regional pavel oyarzun, amigo y companero de ruta literaria. el libro esta disponible en librerias locales como leo el sur (galeria palace), que leo (errazuriz 932) y entre paginas (zona franca). su historia juan magal, nacido en punta arenas en 1962, ha cultivado un estilo literario que trasciende generos, alternando entre la poesia y el cuento. su obra es un reflejo de su vinculo profundo con la region y su paisaje, asi como de sus raices familiares y culturales. influenciado en su ninez por las historias de su abuelo chilote y por el acompanamiento literario del profesor fulvio molteni del liceo luis alberto barrera durante su adolescencia, magal ha desarrollado una prolifica carrera que se extiende por mas de tres decadas. funcionario del servicio nacional del patrimonio cultural durante mas de 30 anos, ha desempenado un rol clave en la difusion cultural de la region desde la biblioteca publica nº6 y la coordinacion regional de bibliotecas publicas. la obra incluye un prologo del escritor magallanico pavel oyarzun, consolidando una nueva contribucion al panorama literario regional y ofreciendo a lectores y visitantes un recorrido poetico por la esencia de magallanes. entre sus libros publicados, destacan: la lira amordazada, 1989; impronta, cuentos y poemas, en coautoria con pavel oyarzun, dinko pavlov y julio pedrol, 1991; la perra del vecino y otros cuentos, 1993; antologia insurgente, la nueva poesia magallanica, en coautoria con pavel oyarzun, 1998.",Crónica
La Prensa Austral,2025-07-13,concesionaria de zona franca asegura que es “necesario evaluar” los recintos francos,https://laprensaaustral.cl/2025/07/13/concesionaria-de-zona-franca-asegura-que-es-necesario-evaluar-los-recintos-francos/,"f altan cinco anos para que sociedad de rentas inmobiliarias, propiedad del empresario claudio fischer, deje de administrar la concesion de la zona franca de punta arenas. desde el gobierno regional aun no piensan comenzar con la preparacion de las bases de licitacion, segun explico el gobernador jorge flies, ya que estan a la espera de saber si el ministerio de hacienda va a legislar sobre la extension de la zona franca hacia el ambito de los servicios y la ampliacion del recinto franco. estos dos temas fueron conversados con hacienda esta semana durante una visita de flies a santiago. la creacion de una zona franca de servicios en magallanes representa una de las apuestas mas ambiciosas para diversificar y modernizar la economia regional. asi lo destaco prieto, quien afirmo que el proyecto “fortalecera nuestra contribucion estructural al desarrollo social y economico de la region”. la iniciativa contempla la habilitacion de 11,6 hectareas adicionales colindantes al recinto actual, adquiridas por el gobierno regional con recursos publicos por $15.480 millones. el objetivo es responder a la creciente demanda -la tasa de vacancia en el modulo central del recinto franco es inferior al 1%- y crear un polo orientado a servicios estrategicos bajo el regimen de franquicia. segun explico el ejecutivo, esta nueva zona franca permitira albergar actividades como la industria salmonera, la manufactura de bienes de capital, logistica avanzada, desarrollo del hidrogeno verde y servicios tecnologicos ligados a energias limpias. “sera una herramienta concreta para descentralizar oportunidades, generar empleo calificado e impulsar inversiones sostenibles”, sostuvo. desde la concesionaria se informo que ya se trabaja en la habilitacion de 15.000 m² adicionales de terrenos arrendables, los cuales estaran disponibles a partir de 2026. una zona franca de servicios depende de que se apruebe la ley de regiones mas fuertes, en donde se incorpora este apartado para que todas las regiones con recinto franco puedan expandirse hacia ese sector economico. posibles cambios al sistema franco el ministerio de hacienda trabaja en una profunda modernizacion del sistema franco, principalmente el de iquique. segun informo el mercurio, a fines de junio la subsecretaria del ramo, heidi berner, durante una visita la ciudad nortina, expuso los pasos que vienen para generar un nuevo modelo de concesion. el objetivo es que las zonas francas puedan responder a los desafios actuales y futuros, alineandose con estrategias de desarrollo regional. el nuevo marco propuesto contempla una gestion colaborativa, con participacion efectiva de los usuarios y actores locales; un sistema tarifario justo y transparente; mejoras en infraestructura, seguridad y condiciones laborales; y un enfoque territorial que promueva el desarrollo sostenible del entorno. tambien se propone avanzar hacia una gestion logistica automatizada, eficiente y fiscalizable. la subsecretaria berner enfatizo que no se puede esperar al vencimiento del contrato actual en 2030, pues ello significaria “cinco anos mas de oportunidades perdidas”. por eso, el ministerio busca establecer desde ya un nuevo marco contractual entre zofri s.a. y el estado, que defina con claridad las obligaciones del concesionario, establezca estandares de servicio e infraestructura, garantice transparencia en tarifas, contemple responsabilidad social y ambiental, y fije mecanismos de evaluacion periodica, ademas de procedimientos para la eventual terminacion anticipada en caso de incumplimientos. impacto de punta arenas aunque estos anuncios se centraron en la zona franca de iquique, tambien tienen impacto en punta arenas, donde la concesion termina igualmente en 2030 y se enfrentan desafios similares para transformar la gestion del recinto franco. “despues de casi 50 anos de funcionamiento, es legitimo y necesario evaluar ajustes que permitan fortalecer los objetivos originales del sistema, manteniendo su vocacion regionalista”, senalo eugenio prieto. a su juicio, los cambios que impulsa hacienda van en linea con lo que ya se ha comenzado a implementar en magallanes. prieto destaco que al modelo de zona franca se deben incorporar estandares modernos en materia de transparencia, gobernanza y evaluacion periodica, pero recalco que la clave para el futuro esta en la diversificacion hacia los servicios: “pueden elevar el impacto del sistema en el desarrollo territorial”, puntualizo.",Pulso económico
La Prensa Austral,2025-07-12,entran en operacion los 10 nuevos buses que vienen a reforzar la flota de la locomocion mayor,https://laprensaaustral.cl/2025/07/12/entran-en-operacion-los-10-nuevos-buses-que-vienen-a-reforzar-la-flota-de-la-locomocion-mayor/,"con visita del ministro de transportes y telecomunicaciones, juan carlos munoz abogabir, este viernes se realizo la inauguracion de los 10 nuevos buses, arribados a la zona en abril pasado a punta arenas, que reforzaran la flota del transporte de locomocion colectiva de la ciudad. la actividad protocolar se realizo en el modulo central de zona franca, con asistencia de parlamentarios y autoridades regionales, ademas de miembros de la sociedad civil, cuyo rol fue destacado en la instancia. en la oportunidad el secretario de estado anuncio los avances en buses para natales y el inicio del pago electronico en la locomocion mayor de punta arenas. la inauguracion de estas 10 maquinas que se suman a la flota va en linea con ir cerrando brechas de calidad en santiago y regiones. asi lo definio el ministro munoz, quien sostuvo que “el transporte publico no es un adorno en una ciudad, el transporte publico es estructural, es funcional, es muy importante no solamente para las personas que no tienen alternativas. si las ciudades siguen avanzando con desarrollar el transporte en base al automovil, van a seguir enfermandose de la misma manera que nuestros cuerpos se enferman de colesterol”. entre los avances destacados figura la separacion de los contratos entre la provision y la operacion de la flota en dos empresas distintas. la reparacion de las maquinas y la suma de esta decena de buses nuevos permitira, segun los calculos del ministerio de transportes, que para el 21 de julio, cuando se produzca el regreso a clases de los estudiantes, tener entre 55 y 60 buses en plena operacion en las calles. buses para puerto natales en la actividad el secretario de estado tambien anuncio que se ha estado avanzando en un proceso de licitacion para adquirir nueve buses para puerto natales, una ciudad que no cuenta con transporte publico. “es una licitacion que ya esta en curso. las bases de la licitacion se han estado presentando, las personas han formulado preguntas, estamos contestando y esperamos prontamente pasar el periodo de recibir ofertas y finalmente adjudicar los contratos”, concluyo el titular de transportes.","Crónica, Titular2"
La Prensa Austral,2025-07-05,expulsaron de chile a primer formalizado por “zoom” en pandemia por trafico de drogas,https://laprensaaustral.cl/2025/07/05/expulsaron-de-chile-a-primer-formalizado-por-zoom-en-pandemia-por-trafico-de-drogas/,"en febrero de 2021 el ciudadano colombiano john sebastian angulo vente, fue sentenciado a 6 anos de carcel por trafico de droga. ahora fue trasladado por la pdi desde punta arenas a santiago y de ahi se concreto su expulsion del territorio nacional. un ano antes, en marzo de 2020, fue detenido por la brigada antinarcoticos en el aeropuerto de nuestra ciudad con 8 “ladrillos” de cannabis sativa adosados a su cuerpo, que pesaron mas de 4 kilos. ver a los policias en el aeropuerto lo puso nervioso y se delato solo, reconociendo que se desempenaba como “correo humano” y que este “trabajito” le reportaria ganancias por 2 millones de pesos. luego de la formalizacion quedo en prision preventiva, convirtiendose en la primera cautelar tramitada y discutida via “zoom”, dado el cierre dispuesto en ese tiempo de los tribunales por efectos del coronavirus. posteriormente, en el juicio oral, angulo vente admitio que su mision era entregar los 4 kilos de marihuana a un amigo de la zona franca. el tribunal oral lo termino condenando, en febrero de 2021, a 6 anos de carcel efectiva. expulsion la policia de investigaciones informo este viernes de la expulsion de “un hombre de nacionalidad colombiana, de 30 anos, que cumplio una condena por haber cometido delito en la region”. la medida la concretaron detectives del departamento de migraciones y policia internacional punta arenas. el jefe de esta unidad, subprefecto patricio gomez, indico que esta medida fue decretada por el servicio nacional de migraciones, en virtud a que, el extranjero fue condenado en febrero de 2021 por el delito de trafico ilicito de drogas. finalmente, el ciudadano colombiano fue puesto a disposicion de las autoridades de su pais, en el aeropuerto internacional de bogota.",Crónica
La Prensa Austral,2025-07-04,mujer muere en la ruta en un inexplicable atropello,https://laprensaaustral.cl/2025/07/04/mujer-muere-en-la-ruta-en-un-inexplicable-atropello/,"m inutos despues de ser socorrida por personal del samu desde la ruta 9 norte, dejo de existir en el hospital clinico de magallanes una mujer de 49 anos, quien durante la tarde de este jueves fue victima de un inexplicable atropello en plena carretera. eran las 16,45 horas cuando el sistema de atencion medica de urgencia recibio la alerta de un grave atropello. el accidente tenia lugar frente a la empresa concremag, a la altura del kilometro 8,4, en la pista que va de norte a sur, donde el chofer de un camion volkswagen, modelo constellation, color blanco, tolva, conducido por m.f.o., quien no pudo evitar impactar a la mujer que se cruzo intempestivamente en su camino, en un lugar no habilitado para el cruce peatonal. segun testigos, minutos antes otros automovilistas habrian esquivado a la misma peaton en las inmediaciones del sector. una ambulancia traslado a la victima hasta el servicio de urgencias del hospital clinico con multiples fracturas, donde pese a los esfuerzos medicos desplegados en el centro asistencial, se certifico su fallecimiento a eso de las 19 horas, a causa de un politraumatismo. por orden del fiscal fernando dobson, en el sitio del suceso trabajo en la investigacion del accidente un equipo de la siat de carab ineros, al mando del capitan alexis pardo montoya, lo que incluyo la toma de declaracion al chofer del camion involucrado. pasadas las 22 horas, el fiscal a cargo decreto la libertad del conductor, quedando este apercibido a comparecer ante una futura citacion. la victima como pamela beatriz ramirez troncoso fue identificada la mujer que perdio la vida en la carretera. era hija del profesor mario ramirez. segun cercanos se desempenaba como corredora de propiedades y habia salido de su domicilio a las 10 horas para dirigirse a zona franca donde atendia un stand destinado a un emprendimiento. asimismo, integro la directiva del partido regionalista de magallanes en 2016, donde ejercio el cargo de tesorera, recordo el abogado juan jose srdanovic, quien se mostro profundamente sorprendido e impactado por su deceso.","Crónica, Titular1"
La Prensa Austral,2025-07-01,los 21 proyectos del plan de zonas extremas para desarrollar a tierra del fuego,https://laprensaaustral.cl/2025/07/01/los-21-proyectos-del-plan-de-zonas-extremas-para-desarrollar-a-tierra-del-fuego/,"gracias al plan de desarrollo de zonas extremas (pdze), los programas de desarrollo para las tres comunas de tierra del fuego podran tener asegurado su financiamiento para prefactibilidad, factibilidad, diseno y ejecucion, en los proximos anos. el listado de los distintos proyectos que incluye el pdze para porvenir y toda la provincia de tierra del fuego, excluye completamente la extension o renovacion de las leyes de excepcion para tierra del fuego, que vencen en menos de 10 anos (enero de 2035). las iniciativas se detallan a continuacion: 1. construccion sistemas autogeneracion electrica cerro sombrero, comuna primavera, ejecucion 2027-2029, por 2.500 millones de pesos. 2. habilitacion y mejoramiento de sistema recoleccion y tratamiento de aguas servidas cerro sombrero, 2026-2027, por $2 mil millones. 3. construccion sistema agua potable loteo selknam y loteo laguna de los cisnes, porvenir, 2026-2028, por 6.800 millones de pesos. 4. construccion sistema agua potable bahia chilota, comuna porvenir, diseno por 500 millones de pesos, ano 2026. 5. construccion sistema agua potable bahia chilota, comuna porvenir, ejecucion 2027-2028, por $3 mil millones. 6. construccion centro de gestion de residuos solidos, tierra del fuego, 2027-2030, por 38 mil millones de pesos. 7. normalizacion plan de cierre vertedero de tierra del fuego (diseno), 2028-2029, por $800 millones. 8. normalizacion plan de cierre vertedero de tierra del fuego, ejecucion 2030-2032, por 3.500 millones de pesos. 9. construccion alternativa conectividad sector primera angostura-bahia azul, provincias de magallanes y tierra del fuego, prefactibilidad 2027-2028, por $1.500 millones. 10. construccion alternativa conectividad sector primera angostura – bahia azul, provincias de magallanes y tierra del fuego, factibilidad 2029-2031, por 5 mil millones de pesos. 11. mejoramiento ruta y-71, porvenir-onaissin, tramo i, provincia de tierra del fuego (km 11 a km 43), ejecucion 2028-2032, por $50 mil millones. 12. mejoramiento ruta y-71, porvenir-onaissin, tramo ii, provincia de tierra del fuego (cruce baquedano km 43 a onaissin km 59,32), ejecucion 2025-2028, por 48.460 millones de pesos. 13. construccion, diagnostico e identificacion y clasificacion de vias urbanas en funcion de su estado de conservacion, proyecto compartido en comunas de porvenir, punta arenas y natales, 2026 por $500 millones. 14. construccion ultima milla solucion digital, wi-fi y fibra optica con antenas banda 3000, comunas rurales (proyecto compartido entre laguna blanca, rio verde, san gregorio, primavera, timaukel, torres del paine y villa renoval), 2026-2029, por 6 mil millones de pesos. 15. adquisicion de terrenos creacion “zona franca remota” en comunas de porvenir y natales, ejecucion 2027-2029, por $10 mil millones. 16. construccion de obra de almacenamiento de agua y desarrollo de riego tecnificado en porvenir, factibilidad 2028-2029, por $600 millones. 17. construccion de obra de almacenamiento de agua y desarrollo de riego tecnificado en porvenir, diseno 2030-2031, por 800 millones de pesos (en el listado no se incluyo el proyecto de ejecucion). 18. mejoramiento costaneras (punta arenas, porvenir, puerto williams, puerto natales), ejecucion 2027-2035, por $40 mil millones. 19. construccion escuela bernardo o’higgins, porvenir, diseno 2027-2028, por 389 millones de pesos. 20. construccion escuela bernardo o’higgins, porvenir, ejecucion 2028-2030, por $15.200 millones. 21. construccion piscina semiolimpica temperada, comuna porvenir, ejecucion 2028-2030, por 8 mil 464 millones de pesos.",Fueguinas
La Prensa Austral,2025-06-28,zona franca y el mall cerraran sus puertas este domingo,https://laprensaaustral.cl/2025/06/28/zona-franca-y-el-mall-cerraran-sus-puertas-este-domingo/,"este domingo zona franca y el mall espacio urbano pionero cerraran sus puertas con motivo de las elecciones primarias, ya que segun la ley aquellos trabajadores que se desempenen en malls, strip centers o complejos comerciales administrados bajo una misma razon social o personalidad juridica tienen derecho a feriado legal obligatorio e irrenunciable. estos locales deben cerrar sus puertas esta noche a las 21 horas y no podran reabrir hasta el lunes 30 a partir de las 6 horas. el incumplimiento de esta normativa puede significar multas que van desde las 30 utm ($2.036.550) hasta 150 utm ($10.317.750), dependiendo del tamano de la empresa. el resto de comercio que no se encuentre en estos espacios podran operar con normalidad. solo podran abrir los supermercados que se encuentren fuera de estos recintos. los trabajadores que deban cumplir funciones durante la jornada electoral tienen derecho a ausentarse de su lugar de trabajo por al menos tres horas para ejercer su derecho a voto. quienes no otorguen las tres horas minimas para sufragar o para cumplir funciones electorales arriesgan sanciones que fluctuan entre 3 y 60 utm, tambien en funcion del tamano de la empresa. la direccion del trabajo fiscalizara la jornada electoral a nivel nacional.",Crónica
La Prensa Austral,2025-06-14,comediante felipe izquierdo trae su show a local de zona franca,https://laprensaaustral.cl/2025/06/14/comediante-felipe-izquierdo-trae-su-show-a-local-de-zona-franca/,"hoy sabado, a contar de las 19 horas, en el marco de la celebracion del dia del padre, el local de musica itech de zona franca, brindara un espectaculo artistico que contara con la destacada participacion del reconocido comediante nacional felipe izquierdo, quien presentara su show de stand up comedy, ofreciendo una experiencia llena de humor. sera una jornada imperdible, en la que se combinara musica de calidad y comedia para disfrutar en familia. desde la productora two-ely’s, se indico que la jornada la abrira la joven artista regional dominga rodriguez, interpretando una cuidada seleccion de covers que pondran en valor su gran talento. ella viene de presentarse junto al pianista nacional francisco gonzalez en un memorable concierto realizado en el palacio taj mahal en santiago. se trata de un evento privado, con invitaciones.",Crónica
La Prensa Austral,2025-06-12,zona franca rompe records de ventas durante el primer trimestre,https://laprensaaustral.cl/2025/06/12/zona-franca-rompe-records-de-ventas-durante-el-primer-trimestre/,"fue impulsado principalmente por el dinamismo de los locales comerciales, que concentraron el 67% de las operaciones totales. sin embargo, la venta de vehiculos sigue en numeros rojos. entre enero y marzo, mas de 2,6 millones de personas visitaron la zona franca de punta arenas, con un promedio mensual cercano a las 880 mil visitas. esto equivale a una rotacion de 5,3 veces la poblacion regional, posicionando al recinto como uno de los espacios mas concurridos del pais fuera de santiago. con ventas por 127 millones de dolares entre enero y marzo (118 mil 691 millones de pesos), la zona franca de punta arenas cerro el mejor primer trimestre de su historia, registrando un crecimiento del 24% respecto al mismo periodo de 2024. las cifras consolidan al recinto como el principal polo comercial, logistico y de servicios del sur austral del pais. el resultado fue impulsado principalmente por el dinamismo de los locales comerciales, que concentraron el 67% de las operaciones totales, con ventas que superaron los 86 millones de dolares, un aumento del 30% en comparacion al ano anterior. la cifra refleja una alta demanda del consumo regional y una mayor frecuencia de visitas al recinto. “estamos observando una recuperacion sostenida de la actividad, con mas marcas nacionales e internacionales y un ecosistema de servicios en expansion”, afirmo eugenio prieto, gerente general de la sociedad de rentas inmobiliarias (sri), concesionaria de la zona franca. el buen momento tambien se refleja en otros indicadores. las ventas en depositos publicos -que concentran insumos industriales y bienes de capital- llegaron a 31 millones de dolares, un alza del 28%. en tanto, las reexpediciones de productos, principalmente hacia argentina, crecieron un 20,6% en el mismo periodo. el ano pasado tambien estuvo marcado por la apertura de 22 nuevos locales, entre ellos marcas como natura, gmo, helly hansen y revesderecho, ademas de la reapertura del hipermercado rofil. no todo fue positivo. el segmento de vehiculos continuo en baja, registrando una caida del 17,7% en valor. sin embargo, desde la concesionaria proyectan una recuperacion en el segundo semestre. repunte del turismo argentino entre enero y marzo, mas de 2,6 millones de personas visitaron la zona franca de punta arenas, con un promedio mensual cercano a las 880 mil visitas. esto equivale a una rotacion de 5,3 veces la poblacion regional, posicionando al recinto como uno de los espacios mas concurridos del pais fuera de santiago. el turismo argentino tambien dio senales de reactivacion. segun datos oficiales, 86.844 trasandinos ingresaron a la region de magallanes en el primer trimestre, lo que representa un aumento del 41% respecto al mismo periodo de 2024. expansion proyectada el gobierno regional concreto la compra de un terreno de 11,6 hectareas contiguo a la actual zona franca, con una inversion de $15.480 millones aprobada por el consejo regional. esta nueva superficie permitira avanzar hacia una “zona franca de servicios”, iniciativa que busca diversificar la oferta y vincular al recinto con sectores estrategicos como la salmonicultura, la industria primaria y el desarrollo del hidrogeno verde. “la ampliacion de la zona franca generara nuevas oportunidades para empresas y familias, proyectando a la region como referente estrategico en comercio, servicios y logistica en sudamerica”, remato prieto.","Crónica, titular4"
