source,date,title,url,body_text,section
La Prensa Austral,2025-03-19,integrante de familia nandwani zafo del arresto domiciliario total que postulaba la fiscalia tras formalizacion,https://laprensaaustral.cl/2025/03/19/integrante-de-familia-nandwani-zafo-del-arresto-domiciliario-total-que-postulaba-la-fiscalia-tras-formalizacion/,"investigacion por declaraciones maliciosamente falsas e infraccion a ley de zonas francas. c ambiando completamente la estrategia legal y comunicacional, para no repetir errores, el equipo juridico de la familia nandwani presento ayer a laju nandwani vaswani, comerciante de 64 anos de edad, citada por el juzgado de garantia de punta arenas a audiencia de formalizacion de cargos solicitada por el ministerio publico. el supuesto delito tributario en que habria incurrido, junto a su hermano sunil (quien aun no comparece) seria por presentar “declaraciones maliciosamente falsas”, e infraccion a ley de zonas francas. conectada desde su domicilio via “zoom”, laju escucho al fiscal oliver rammsy dickinson explayarse sobre los hechos contemplados en la formalizacion de cargos. la imputacion es porque en su calidad de representante legal de la sociedad real y compania limitada presento declaraciones de impuesto al valor agregado “incompletas o falsas”, entre los periodos tributarios junio de 2018 y diciembre de 2023. con pago de impuestos mucho menores a los que verdaderamente correspondian. esto la llevo a cometer el delito previsto y sancionado en el articulo 97 n°4 del codigo tributario en estado de consumado y en calidad de autora, expuso el fiscal. parte de los antecedentes que se escucharon en la audiencia son que a traves de la sociedad real (usuaria de zona franca desde 2006), la empresa vendio y enajeno un total de 442 vehiculos nuevos, de diferentes marcas a la sucursal que la misma firma tiene en coyhaique. el presunto delito que imputa el ministerio publico dice relacion con que unos 427 vehiculos fueron vendidos a traves de contratos privados de compraventa ante notario publico y otros 15 vehiculos mediante el registro civil e identificacion de chile. pero por estas ventas no se emitieron documentos tributarios, como facturas. el impuesto al valor agregado (iva) por estas ventas no se declaro en los respectivos formularios 29. segun el fiscal, y a la querella del servicio de impuestos que abrio esta investigacion, la imputada, en su calidad de usuaria de zona franca, extendio los beneficios del regimen que ampara al recinto amurallado de punta arenas, siendo que solo es aplicable en la zona franca primaria o tambien llamado recinto franco de la capital de magallanes. la ley es clara en beneficiar con la exencion de iva las ventas de las mercancias extranjeras solo para el recinto de punta arenas, “por ser el unico que goza de excepcion de extraterritorialidad aduanera”. los vehiculos fueron importados desde zona franca de punta arenas a la ciudad de coyhaique (mediante solicitud registro factura, srf) a nombre de la misma empresa, sociedad real y compania limitada. y los inscribieron a su propio nombre para obtener la placa patente. el fiscal dijo que el perjuicio para el fisco es de $1.053.210.672, que actualizado a enero 2025, alcanza la suma de $1.281.404.732 por concepto de impuesto al valor agregado. por el servicio de impuestos internos comparecio el abogado querellante jorge mihovilovic. y por el equipo juridico de la familia nandwani, german ovalle, de forma presencial; juan carlos manriquez y sergio salas arriagada, ambos se conectaron por “zoom”. por seis horas se extendio la audiencia de formalizacion de cargos. el fiscal pidio el arresto domiciliario total para la imputada. los defensores se opusieron, con extensos argumentos juridicos, y al final la jueza paula stange solo impuso el arraigo regional, por los 8 meses que dure la investigacion. queda pendiente la audiencia de formalizacion, por los mismos cargos, en contra de sunil nandwani, para quien la corte suprema mantuvo ayer la orden de detencion por no presentarse a las audiencias agendadas con este motivo.",Crónica
La Prensa Austral,2025-03-13,condenaron a sujeto que compraba en el comercio con billetes falsos de 10 mil pesos,https://laprensaaustral.cl/2025/03/13/condenaron-a-sujeto-que-compraba-en-el-comercio-con-billetes-falsos-de-10-mil-pesos/,"a tres penas de 61 dias cada una fue condenado ayer un sujeto que realizo compras en punta arenas utilizando billetes falsos de 10 mil pesos. ademas se le impuso una pena de 100 dias de presidio por el delito de hurto, segun el fallo del juez ricardo herrera. el autor, robinson guzman caceres, fue denunciado por comerciantes afectados por sus maniobras fraudulentas. en una ocasion, el 7 de agosto de 2023, ingreso al minimarket de calle chiloe nº930 a comprar dos cafe de maquina. le cancelo a la cajera con un billete de 10 mil pesos, que sabia que era falsificado. pero antes recorrio el local y sustrajo dos tarros de crema de leche, los que oculto en la mochila que portaba. en el intertanto la dependiente le entrego el vuelto de los 10 mil pesos, y mas encima se llevo las latas de crema. dias despues, el 15 de agosto, el sujeto volvio al mismo local comercial de nombre minimarket bauer, con otros 10 mil pesos falsos. cancelo una bebida de litro y recibio el vuelto. a traves de este delito hizo circular en el comercio local dinero falsificado. el 22 de agosto de ese mismo ano, aproximadamente a las 16,30 horas, robinson guzman, acompanado de una mujer, ingreso al local comercial ubicado en calle chiloe esquina calle jose menendez. el portaba un billete de similares caracteristicas a uno de $10.000 pero era falso. utilizo el mismo mecanismo. pago y recibio el vuelto, generando perjuicio economico en todos los afectados. al otro dia, el 23 de agosto, a las diez de la manana fue a zona franca. ingreso al local nº258, correspondiente a una casa de cambios. el establecimiento estaba cerrado, con la cortina abajo, pero por un orificio de la ventana de atencion al publico, utilizado para el intercambio de dinero con los clientes, introdujo su mano y sustrajo un notebook, avaluado en 500 mil pesos, el que escondio en la mochila que llevaba, para luego retirarse del lugar. la especie fue encontrada en poder del imputado, cuando intentaba venderla en el local de reparacion de equipos tecnologicos ubicado en chiloe n°862. a raiz de un control de identidad realizado por personal policial, el imputado manifesto que dicho notebook no era de su propiedad y lo entrego de forma voluntaria. la especie fue reconocida posteriormente por la victima. el acusado, y la mujer que lo acompanaba, fueron denunciados en redes sociales, con publicaciones donde aparecian en fotos captadas de las camaras de seguridad de locales comerciales. fue asi que aparecieron varios dando cuenta del accionar de los antisociales.",Crónica
La Prensa Austral,2025-03-12,"cencosud en magallanes: rumores, intentos y una presencia efimera",https://laprensaaustral.cl/2025/03/12/cencosud-en-magallanes-rumores-intentos-y-una-presencia-efimera/,"aunque cencosud es una de las empresas mas valoradas en chile y tiene una presencia consolidada en varios paises de latinoamerica, nunca ha logrado establecer operaciones duraderas en la region de magallanes. junto a aysen son las unicas regiones sin presencia del holding. la supuesta compra a abu-gosch en 2007, se genero una intensa especulacion sobre su llegada a punta arenas, impulsada por la visita del fallecido fundador horst paulmann a la ciudad y rumores sobre la compra de un terreno en la avenida bulnes, frente a la zona franca. tambien se menciono la posible adquisicion de la cadena de supermercados abu-gosch, lider en el retail regional. diversas fuentes indicaban que paulmann sostuvo reuniones con el empresario ramon jacob, dueno de abu-gosch, y con claudio fischer, quien lideraba la sociedad de rentas inmobiliarias ltda., la cual estaba en proceso de asumir la administracion de la zona franca. a pesar de estas versiones, en su oportunidad jacob desmintio cualquier venta de su empresa a cencosud, afirmando que “son solo rumores” y que no existia ninguna negociacion en curso. finalmente, al ano siguiente, abu-gosch confirmo su venta a smu, el consorcio propietario de unimarc, que incorporo los supermercados a su marca, manteniendo solo el local de la zona franca. en 2024, este ultimo fue desocupado y transferido a su nuevo dueno, rofil. el mega mall que no fue en 2012, la constructora socovesa presento un anteproyecto al municipio de punta arenas para la edificacion de un gran centro comercial en la avenida eduardo frei, entre mardones y el ovejero. el proyecto, que contemplaba una construccion de 102.186,94 metros cuadrados, buscaba atraer al holding cencosud, propiedad de horst paulmann, para instalar un hipermercado jumbo o santa isabel y una tienda de hogar, posiblemente easy. pese a que cencosud no tenia planes concretos para ingresar a magallanes, el anteproyecto fue aprobado por la direccion de obras municipales el 6 de agosto de ese ano. la propuesta incluia la construccion inicial de tres niveles subterraneos para estacionamientos y un primer nivel comercial, con una proyeccion de al menos dos anos para su ejecucion. en una segunda etapa, el proyecto contemplaba la expansion del centro comercial con cuatro tiendas ancla y un tercer nivel. el terreno era propiedad de socovesa, que mantenia negociaciones con paulmann mientras realizaba estudios de preinversion. ademas, debido a la alta afluencia de publico esperada, se planteo la necesidad de estudios de impacto vial y la implementacion de semaforizacion. finalmente el proyecto no prospero. la breve presencia junto a johnson’s la unica vez que el holding de horst paulmann tuvo presencia en magallanes fue tras la adquisicion de las multitiendas johnson’s a fines de 2011, las cuales contaban con un local en punta arenas. durante 25 anos, la tienda opero en el edificio ubicado en la esquina de colon con bories, hasta su cierre en 2019. actualmente, la polar ocupa esas dependencias, marcando el fin de la efimera presencia de cencosud en la region, que se extendio por menos de ocho anos. en 2020, el holding de paulmann anuncio la disolucion de johnson’s, lo que llevo a que todas sus tiendas en chile se reconvirtieran a la marca paris.",Crónica
La Prensa Austral,2025-03-09,"unos 10 mil vehiculos cruzaron en cinco dias los controles fronterizos de la region, en largo feriado argentino",https://laprensaaustral.cl/2025/03/09/unos-10-mil-vehiculos-cruzaron-en-cinco-dias-los-controles-fronterizos-de-la-region-en-largo-feriado-argentino/,"aprovechando que el lunes 3 y el martes 4 de marzo fueron dias feriados en argentina, una vez mas ciudades como punta arenas y puerto natales se vieron atestadas de visitantes. el calendario argentino establecio que ambas fechas fueran feriados inamovibles en todo el pais. esto garantizo el primer fin de semana extra largo del ano para el pais vecino. le llaman el feriado del “carnaval” y esta muy ligado a la tradicion catolica y lo celebran 40 dias antes de la semana santa. esto llevo a que cientos de familias argentinas aprovecharan el largo fin de semana de 4 dias para visitar la patagonia chilena. sobre todo aprovechando que el precio de vestuario, alimentos, articulos electronicos, repuestos, neumaticos, entre muchos otros, les son economicamente favorables. entre bromas algunas personas “postearon” en redes sociales que costaba encontrar un chileno el fin de semana pasado en la zona franca de punta arenas, en alusion a la cantidad de argentinos que compraban en el principal centro comercial del sur de chile. cifras realizadas las consultas en aduanas, se nos informo que entre el viernes 28 de febrero y el 4 de marzo ingresaron 4.792 vehiculos, 116 buses y 16.813 pasajeros en total. estas cifras abarcan los pasos fronterizos monte aymond, san sebastian, dorotea, casas viejas, rio don guillermo y bellavista. por los mismos recintos salieron 4.817 vehiculos particulares y 114 buses, totalizando 16.241 pasajeros. entre los vehiculos y buses que entraron y salieron por estos controles fronterizos, entre el 28 de febrero y el 4 de marzo, suman cerca de 10 mil rodados y 33.054 pasajeros.",Crónica
La Prensa Austral,2025-03-04,los oficios de impuestos internos a sociedad real y cia que habrian evitado una querella contra nandwani,https://laprensaaustral.cl/2025/03/04/los-oficios-de-impuestos-internos-a-sociedad-real-y-cia-que-habrian-evitado-una-querella-contra-nandwani/,"lucas ulloa intveen l e n 2022 el servicio de impuestos internos (sii) presento una querella en contra de sociedad real y compania limitada, controlada por la familia nandwani, por delitos tributarios perpetrados en periodos de tiempo especificos. la estrategia utilizada para evadir la declaracion de impuestos o emision de facturas cambio a lo largo del tiempo y especialmente a partir de 2018. ese ano la empresa solicito un pronunciamiento al servicio de impuestos internos sobre sus operaciones y desde ahi fueron advertidos que las ventas estaban gravadas con iva. a partir de ahi, las ventas fueron formalizadas bajo contratos ante notario. sociedad real y cia. cuenta con giro de importacion y venta de vehiculos motorizados, operando en la zona franca primaria de punta arenas y en la zona franca de extension. hasta 2018, para despachar los vehiculos al punto de venta en coyhaique y comercializarlos, la sociedad emitia a su propio nombre una “solicitud registro factura” (srf), para facilitar el transporte a los puntos de venta. reconocian que dicha operacion no tiene naturaleza juridica de venta. luego la sociedad preinscribia los vehiculos en el registro de vehiculos motorizados del registro civil de coyhaique con fines registrales y para la emision de la placa patente. finalmente, al ser el vehiculo comprado por un cliente, se inscribia a nombre de este y se pagaba el permiso de circulacion. segun lo manifestado por el contribuyente, el procedimiento anterior tiene como unico proposito sacar del recinto amurallado los vehiculos, para efectuar su venta en la tienda de coyhaique y asi facilitar su transporte via terrestre a dicha ciudad. posteriormente, la sociedad efectua la venta y la entrega material de los vehiculos en la capital de la region de aysen a los clientes que habitan la zona. el precio de venta de estos tanto en la zona franca primaria como en la zona franca de extension es exactamente el mismo y los vehiculos son vendidos en ambas zonas sin recargar el impuesto al valor agregado. analisis del sii y oficios sobre la anterior operacion solicitaron el pronunciamiento a la direccion nacional del servicio de impuestos internos, quienes emitieron un oficio el 11 de junio de 2018 con un analisis de la materia. la principal conclusion de su analisis fue que “no procede aplicar la liberacion de iva a la venta de vehiculos que el contribuyente traslada, con una srf a su nombre, desde zona franca de punta arenas a sus propios puntos de venta, situados en coyhaique, a fin de comercializarlos en ese lugar sin iva”. la argumentacion de fondo es que “segun el procedimiento establecido por el servicio nacional de aduanas, la importacion de mercancias extranjeras desde zona franca de punta arenas hacia la region de aysen, para su uso en dicha zona, supone que la destinacion aduanera tiene como antecedente la adquisicion de la mercancia en zona franca de punta arenas, por lo que la solicitud registro factura (srf), tiene por objeto dar cuenta tanto de la adquisicion de la mercancia en zona franca de punta arenas como de su posterior importacion para uso en zona franca de extension” en consecuencia, el ingreso de mercancias desde zona franca de punta arenas a la region de aysen y provincia de palena, solo permite la importacion de mercancias para su uso en zona franca de extension, destinacion aduanera que implica, necesariamente, una venta. “por lo tanto, si el contribuyente transfiere los vehiculos en zona franca de extension, dicha venta se encontrara gravada con impuesto al valor agregado”. solicitaron reconsiderar dicho pronunciamiento y finalmente el 9 de marzo de 2020, un segundo oficio del sii lo ratifico, indicando que “no procede acoger su solicitud, en terminos de dejar sin efecto lo resuelto por este servicio”. a su vez agregan respecto a vulneracion de derechos constitucionales, “mediante sentencia de fecha 21 de enero de 2020, el tribunal constitucional rechazo, en todas sus partes, el requerimiento de inaplicabilidad por inconstitucionalidad interpuesto por usted, sobre esta materia”. la querella y situacion judicial a 1.281 millones de pesos asciende, en principio, el perjuicio fiscal ocasionado por sociedad real y cia. limitada, empresa comercializadora de vehiculos en la zona franca de punta arenas, de acuerdo a la investigacion realizada por el servicio de impuestos internos (sii), mediante la cual logro detectar que, entre junio de 2018 y diciembre de 2023, 442 vehiculos nuevos fueron vendidos sin emision de facturas ni declarar el impuesto al valor agregado (iva). segun los registros del sii, los vehiculos fueron importados desde la zona franca de punta arenas a coyhaique, y las ventas se realizaron mediante contratos privados ante notario publico o en el registro civil, ocultando deliberadamente las operaciones a la autoridad tributaria. los imputados, amparandose en su calidad de usuario de zona franca (desde 2006), utilizaron indebidamente un beneficio tributario que solo es valido en el recinto franco de punta arenas, evadiendo el pago del iva por las ventas realizadas en coyhaique. a raiz de todo lo anterior es que emano la querella presentada el 16 de agosto del 2022, la cual se encuentra en tramitacion hasta la fecha y actualmente desformalizada. sin embargo esto es asi toda vez que no se ha logrado llevar a cabo la audiencia de formalizacion en contra de uno de los representantes, sunil nandwani, sobre quien pesa una orden de detencion.",Crónica
La Prensa Austral,2025-03-02,creadoras australes impulsan el emprendimiento femenino y la economia circular en punta arenas,https://laprensaaustral.cl/2025/03/02/creadoras-australes-impulsan-el-emprendimiento-femenino-y-la-economia-circular-en-punta-arenas/,"la agrupacion creadoras australes, integrada por 15 mujeres jefas de hogar y cuidadoras, se ha consolidado como una iniciativa que busca fortalecer la autonomia economica de sus integrantes, a traves de la creacion y comercializacion de productos hechos a mano con un enfoque sostenible. la agrupacion, que nacio en junio de 2024, ha encontrado en la colaboracion y la economia circular un camino para potenciar sus emprendimientos. sus socias trabajan en rubros como la confeccion textil, la bisuteria y la cosmetica natural, destacando el uso de materiales reciclados y tecnicas que prolongan la vida util de los insumos. en esta nueva feria, el publico podra conocer productos como accesorios elaborados con retazos de lycra, vestimenta para duendes artesanales confeccionada con algodon reciclado, cremas naturales y articulos de decoracion con elementos reutilizados. el trabajo colectivo ha permitido a las emprendedoras reducir costos de materia prima, al tiempo que fortalece la red de colaboracion entre ellas, generando un impacto positivo tanto en su autonomia economica como en la comunidad. ademas de la venta de productos, la feria contara con talleres gratuitos abiertos al publico, donde se compartiran conocimientos adquiridos durante el proceso de formacion. el proyecto, ejecutado gracias al programa emprendamos grupal autogestionado del fondo de solidaridad e inversion social (fosis), permitio a las socias acceder a asesorias y capacitaciones para incorporar la economia circular en sus procesos productivos. esta estrategia promueve la reutilizacion de materiales, la reduccion de residuos y la produccion sostenible, generando un impacto positivo en el medio ambiente y en la comunidad. la presidenta, carola poblete lemus, destaco que el proyecto ha significado no solo una oportunidad de crecimiento economico, sino tambien de transformacion en la manera de trabajar. gracias al acompanamiento de la consultora economia recircular, las socias aprendieron a optimizar el uso de energia, seleccionar proveedores locales y reutilizar insumos para la creacion de nuevos productos. desde su conformacion, en junio del ano pasado, la agrupacion ha buscado no solo mejorar las oportunidades de comercializacion, sino tambien transformar sus emprendimientos en modelos sostenibles, reduciendo residuos y reutilizando materiales para crear nuevos productos. gracias al acompanamiento de la consultora economia recircular, las participantes han adquirido herramientas para optimizar el uso de energia, seleccionar proveedores locales y disminuir el impacto ambiental de sus talleres. feria expo mujer como parte del cierre del proyecto, la agrupacion puso en marcha este sabado la feria expo mujer organizado por creadoras australes, que se llevara a cabo hasta el 7 de marzo en la sala austral de zona franca, frente a la pista de patinaje. en la feria participan 13 de las 15 socias, quienes exponen productos como accesorios en macrame, bisuteria, cosmetica natural, decoracion con materiales reutilizados, vestimenta artesanal y reposteria casera. ademas, la actividad contara con un desfile de modas con productos elaborados por las propias emprendedoras, donde participaran familiares y amigos, destacando la colaboracion y la inclusion como pilares fundamentales del proyecto. financiamiento y visibilizacion el proyecto conto con un financiamiento de $5.206.700, destinado a la adquisicion de mesas plegables, toldos, manteles con logos, parlantes, microfonos inalambricos, poleras estampadas y material de difusion. ademas, el financiamiento permitio la realizacion de talleres de capacitacion en economia circular y la difusion del quehacer de la agrupacion a traves de medios locales, radio, television y redes sociales.",Crónica
La Prensa Austral,2025-03-02,los argentinos vinieron de compras a punta arenas en largo fin de semana para ellos,https://laprensaaustral.cl/2025/03/02/los-argentinos-vinieron-de-compras-a-punta-arenas-en-largo-fin-de-semana-para-ellos/,"un fin de semana extra largo de 4 dias fue aprovechado por los compradores argentinos para visitar el comercio de punta arenas. la presencia de vehiculos con patentes extranjeras y familias completas portando bolsas con diversos articulos se observaron en zona franca, el mall y la principal calle bories. el lunes 3 y martes 4 de marzo nuestros vecinos hacen uso del feriado nacional de carnaval, lo que explica la estampida de argentinos hacia territorio chileno, para adquirir ropa y utiles escolares, ante lo conveniente que significa para ellos los precios. no solo el comercio saca cuentas alegres con estos compradores, sino tambien los restaurantes, hostales y hoteles de la ciudad.","Crónica, Titular3"
La Prensa Austral,2025-02-27,cierre exitoso de las colonias de verano en san gregorio,https://laprensaaustral.cl/2025/02/27/cierre-exitoso-de-las-colonias-de-verano-en-san-gregorio/,"durante tres dias, ninos de la comuna de san gregorio disfrutaron de una variada programacion de actividades recreativas, educativas y deportivas, disenadas para fomentar el aprendizaje, la socializacion y el desarrollo integral de los participantes. el cierre de esta iniciativa tuvo lugar el viernes 21 de febrero con una esperada excursion al parque de trampolines city jump, en el modulo central de zona franca de punta arenas. en esta actividad participaron 21 ninos, quienes tuvieron la oportunidad de disfrutar de una jornada llena de diversion y movimiento, despidiendo de la mejor manera una experiencia que, para muchos, represento una de las mejores vivencias del verano. las colonias de verano se llevaron a cabo entre el 19 y el 21 de febrero en villa punta delgada, con la participacion de ninos y ninas de entre 5 y 14 anos. bajo la coordinacion de la profesora de educacion fisica barbara cardenas ruiz, las actividades fueron disenadas para estimular el desarrollo motriz, la creatividad y la interaccion social de los asistentes. el primer dia, los pequenos participaron en dinamicas de integracion a traves de juegos grupales, circuitos psicomotores y actividades de respiracion. en la jornada de la tarde, se realizaron juegos recreativos y manualidades. el segundo dia comenzo con mini olimpiadas, donde los ninos demostraron sus habilidades en diversas estaciones de destreza, luego prepararon sandwiches saludables y jugos naturales, y en la tarde realizaron una caminata guiada por villa punta delgada. la jornada culmino con una sesion de yoga y un taller de reposteria infantil. desde la municipalidad destacaron la importancia de este tipo de iniciativas para la infancia de san gregorio, asegurando que estas actividades seguiran siendo una prioridad en las politicas comunales de desarrollo infantil.",La lleva
